{
  "@id": "https://example.org/assertions/12345",
  "@type": "ods:Assertion",
  "dwc:measurementID": "9c752d22-b09a-11e8-96f8-529269fb1459",
  "dwc:parentMeasurementID": "E1_E1_O1_M1",
  "dwc:measurementType": "length",
  "dwciri:measurementType": "https://vocab.nerc.ac.uk/collection/P01/current/ODRYBM01/",
  "dwc:measurementDeterminedDate": "2024-05-30T15:16:00.000Z",
  "dwc:measurementValue": "10.0",
  "dwciri:measurementValue": "https://vocab.nerc.ac.uk/collection/L22/current/TOOL0960/",
  "dwc:measurementAccuracy": "0.1",
  "dwc:measurementUnit": "m",
  "dwciri:measurementUnit": "https://vocab.nerc.ac.uk/collection/P06/current/UMSQ/",
  "ods:assertionByAgentName": "Jane Doe",
  "ods:assertionByAgentID": "https://orcid.org/0000-0002-1825-0097",
  "ods:assertionProtocol": "Standard Measurement Protocol",
  "ods:assertionProtocolID": "https://example.org/protocols/67890",
  "ods:assertionRemarks": "Measurement taken using a standard ruler."
}